<?xml version="1.0" encoding="UTF-8"?>
<br:Building_Information xmlns:br="http://www.siemens.com/import/brick/Brick_Building"
 xmlns:xsi="http://www.w3.org/2001/XMLSchema-instance"
 xsi:schemaLocation="http://www.siemens.com/import/brick/Brick_Building file:/Users/jackhodges/Ontologies/Brick_Building.xsd">
    <ResourceID>ResourceID0</ResourceID>
    <Building_Electrical_Meter>
        <btag>Building_Electrical_Meter</btag>
        <uuid>uuid0</uuid>
        <timestamp>2006-05-04T18:13:51.0</timestamp>
        <value>0</value>
    </Building_Electrical_Meter>
    <Weather_Temperature_Sensor>
        <btag>Weather_Temperature_Sensor</btag>
        <uuid>uuid1</uuid>
        <timestamp>2006-05-04T18:13:51.0</timestamp>
        <value>0</value>
    </Weather_Temperature_Sensor>
</br:Building_Information>
